{
	"$ref": "#/definitions/ProfileInterface",
	"$schema": "http://json-schema.org/draft-07/schema#",
	"definitions": {
		"ProfileInterface": {
			"additionalProperties": false,
			"properties": {
				"id": {
					"type": "string"
				},
				"items": {
					"items": {
						"additionalProperties": false,
						"properties": {
							"category": {
								"type": "string"
							},
							"id": {
								"type": "string"
							},
							"name": {
								"type": "string"
							},
							"stackSize": {
								"type": "number"
							},
							"type": {
								"enum": ["item", "fluid"],
								"type": "string"
							}
						},
						"required": ["id", "type", "category", "stackSize"],
						"type": "object"
					},
					"type": "array"
				},
				"logistics": {
					"items": {
						"additionalProperties": false,
						"properties": {
							"features": {
								"items": {
									"additionalProperties": false,
									"properties": {
										"effectPerSlot": {
											"items": {
												"type": "string"
											},
											"type": "array"
										},
										"hidden": {
											"type": "boolean"
										},
										"id": {
											"type": "string"
										},
										"itemSlots": {
											"type": "number"
										},
										"modifiable": {
											"type": "boolean"
										},
										"name": {
											"type": "string"
										}
									},
									"required": ["id", "itemSlots", "effectPerSlot"],
									"type": "object"
								},
								"type": "array"
							},
							"id": {
								"type": "string"
							},
							"speed": {
								"type": "number"
							},
							"type": {
								"enum": ["item", "fluid"],
								"type": "string"
							}
						},
						"required": ["id", "type", "speed"],
						"type": "object"
					},
					"type": "array"
				},
				"machineEffects": {
					"items": {
						"anyOf": [
							{
								"additionalProperties": false,
								"properties": {
									"allowedEffects": {
										"items": {
											"type": "string"
										},
										"type": "array"
									},
									"available": {
										"type": "boolean"
									},
									"displayOffset": {
										"type": "number"
									},
									"hidden": {
										"type": "boolean"
									},
									"id": {
										"type": "string"
									},
									"modifiers": {
										"items": {
											"additionalProperties": false,
											"properties": {
												"id": {
													"enum": [
														"speed",
														"power",
														"consumption",
														"productivity",
														"pollution",
														"quality"
													],
													"type": "string"
												},
												"name": {
													"type": "string"
												},
												"value": {
													"type": "number"
												},
												"valueScaling": {
													"enum": ["exponential", "squared"],
													"type": "string"
												}
											},
											"required": ["id", "value"],
											"type": "object"
										},
										"type": "array"
									},
									"name": {
										"type": "string"
									},
									"singleUse": {
										"type": "boolean"
									},
									"type": {
										"const": "fixed",
										"type": "string"
									}
								},
								"required": ["available", "id", "modifiers", "type"],
								"type": "object"
							},
							{
								"additionalProperties": false,
								"properties": {
									"allowedEffects": {
										"items": {
											"type": "string"
										},
										"type": "array"
									},
									"available": {
										"type": "boolean"
									},
									"displayOffset": {
										"type": "number"
									},
									"hidden": {
										"type": "boolean"
									},
									"id": {
										"type": "string"
									},
									"maxValue": {
										"type": "number"
									},
									"minValue": {
										"type": "number"
									},
									"modifiers": {
										"items": {
											"additionalProperties": false,
											"properties": {
												"id": {
													"enum": [
														"speed",
														"power",
														"consumption",
														"productivity",
														"pollution",
														"quality"
													],
													"type": "string"
												},
												"name": {
													"type": "string"
												},
												"value": {
													"type": "number"
												},
												"valueScaling": {
													"enum": ["exponential", "squared"],
													"type": "string"
												}
											},
											"required": ["id", "value"],
											"type": "object"
										},
										"type": "array"
									},
									"name": {
										"type": "string"
									},
									"singleUse": {
										"type": "boolean"
									},
									"step": {
										"type": "number"
									},
									"type": {
										"const": "stepped",
										"type": "string"
									}
								},
								"required": [
									"available",
									"id",
									"maxValue",
									"minValue",
									"modifiers",
									"step",
									"type"
								],
								"type": "object"
							},
							{
								"additionalProperties": false,
								"properties": {
									"allowedEffects": {
										"items": {
											"type": "string"
										},
										"type": "array"
									},
									"available": {
										"type": "boolean"
									},
									"displayOffset": {
										"type": "number"
									},
									"hidden": {
										"type": "boolean"
									},
									"id": {
										"type": "string"
									},
									"maxValue": {
										"type": "number"
									},
									"minValue": {
										"type": "number"
									},
									"modifiers": {
										"items": {
											"additionalProperties": false,
											"properties": {
												"id": {
													"enum": [
														"speed",
														"power",
														"consumption",
														"productivity",
														"pollution",
														"quality"
													],
													"type": "string"
												},
												"name": {
													"type": "string"
												},
												"value": {
													"type": "number"
												},
												"valueScaling": {
													"enum": ["exponential", "squared"],
													"type": "string"
												}
											},
											"required": ["id", "value"],
											"type": "object"
										},
										"type": "array"
									},
									"name": {
										"type": "string"
									},
									"singleUse": {
										"type": "boolean"
									},
									"type": {
										"const": "modifiable",
										"type": "string"
									}
								},
								"required": ["available", "id", "maxValue", "minValue", "modifiers", "type"],
								"type": "object"
							},
							{
								"additionalProperties": false,
								"properties": {
									"allowedEffects": {
										"items": {
											"type": "string"
										},
										"type": "array"
									},
									"available": {
										"type": "boolean"
									},
									"displayOffset": {
										"type": "number"
									},
									"hidden": {
										"type": "boolean"
									},
									"id": {
										"type": "string"
									},
									"maxValue": {
										"type": "number"
									},
									"minValue": {
										"type": "number"
									},
									"modifiers": {
										"items": {
											"additionalProperties": false,
											"properties": {
												"id": {
													"enum": [
														"speed",
														"power",
														"consumption",
														"productivity",
														"pollution",
														"quality"
													],
													"type": "string"
												},
												"name": {
													"type": "string"
												},
												"value": {
													"type": "number"
												},
												"valueScaling": {
													"enum": ["exponential", "squared"],
													"type": "string"
												}
											},
											"required": ["id", "value"],
											"type": "object"
										},
										"type": "array"
									},
									"name": {
										"type": "string"
									},
									"singleUse": {
										"type": "boolean"
									},
									"type": {
										"const": "limited",
										"type": "string"
									}
								},
								"required": ["available", "id", "modifiers", "type"],
								"type": "object"
							}
						]
					},
					"type": "array"
				},
				"machines": {
					"items": {
						"additionalProperties": false,
						"properties": {
							"available": {
								"type": "boolean"
							},
							"features": {
								"items": {
									"additionalProperties": false,
									"properties": {
										"effectPerSlot": {
											"items": {
												"type": "string"
											},
											"type": "array"
										},
										"hidden": {
											"type": "boolean"
										},
										"id": {
											"type": "string"
										},
										"itemSlots": {
											"type": "number"
										},
										"modifiable": {
											"type": "boolean"
										},
										"name": {
											"type": "string"
										}
									},
									"required": ["id", "itemSlots", "effectPerSlot"],
									"type": "object"
								},
								"type": "array"
							},
							"id": {
								"type": "string"
							},
							"limitations": {
								"items": {
									"type": "string"
								},
								"type": "array"
							},
							"name": {
								"type": "string"
							},
							"recipeCategories": {
								"items": {
									"type": "string"
								},
								"type": "array"
							},
							"requiredPower": {
								"type": "number"
							}
						},
						"required": ["id", "available", "recipeCategories", "requiredPower", "features"],
						"type": "object"
					},
					"type": "array"
				},
				"name": {
					"type": "string"
				},
				"recipes": {
					"items": {
						"additionalProperties": false,
						"properties": {
							"available": {
								"type": "boolean"
							},
							"category": {
								"type": "string"
							},
							"craftable": {
								"type": "boolean"
							},
							"duration": {
								"type": "number"
							},
							"id": {
								"type": "string"
							},
							"in": {
								"items": {
									"additionalProperties": false,
									"properties": {
										"amount": {
											"type": "number"
										},
										"id": {
											"type": "string"
										}
									},
									"required": ["id", "amount"],
									"type": "object"
								},
								"type": "array"
							},
							"limitations": {
								"items": {
									"type": "string"
								},
								"type": "array"
							},
							"name": {
								"type": "string"
							},
							"out": {
								"items": {
									"additionalProperties": false,
									"properties": {
										"amount": {
											"type": "number"
										},
										"id": {
											"type": "string"
										}
									},
									"required": ["id", "amount"],
									"type": "object"
								},
								"type": "array"
							},
							"priority": {
								"type": "number"
							}
						},
						"required": ["id", "available", "in", "out", "duration", "category", "priority"],
						"type": "object"
					},
					"type": "array"
				},
				"research": {
					"items": {
						"additionalProperties": false,
						"properties": {
							"id": {
								"type": "string"
							},
							"name": {
								"type": "string"
							},
							"prerequisites": {
								"items": {
									"type": "string"
								},
								"type": "array"
							},
							"unlocks": {
								"items": {
									"additionalProperties": false,
									"properties": {
										"ids": {
											"items": {
												"type": "string"
											},
											"type": "array"
										},
										"type": {
											"const": "recipe",
											"type": "string"
										}
									},
									"required": ["type", "ids"],
									"type": "object"
								},
								"type": "array"
							}
						},
						"required": ["id", "unlocks"],
						"type": "object"
					},
					"type": "array"
				},
				"settings": {
					"additionalProperties": false,
					"properties": {
						"allRecipesUnlocked": {
							"type": "boolean"
						},
						"defaultDuration": {
							"type": "number"
						},
						"limitations": {
							"items": {
								"type": "string"
							},
							"type": "array"
						},
						"nameOverride": {
							"additionalProperties": false,
							"properties": {
								"quality": {
									"type": "string"
								}
							},
							"type": "object"
						}
					},
					"required": ["defaultDuration", "allRecipesUnlocked"],
					"type": "object"
				}
			},
			"required": [
				"id",
				"name",
				"items",
				"recipes",
				"machines",
				"logistics",
				"machineEffects",
				"research",
				"settings"
			],
			"type": "object"
		}
	}
}
